source_id,authors_year,title,source_type,main_focus,what_it_gives_us,how_we_will_use_it,notes,status
L1,"Wang et al. (2023)","DecodingTrust: A Comprehensive Assessment of Trustworthiness in GPT Models","Benchmark paper","LLM trustworthiness benchmark","Main benchmark inspiration for evaluating trustworthiness dimensions","Use in Introduction, Related Work, and Methodology to justify benchmark-style evaluation","Primary benchmark anchor for this assignment","To read and summarise"
L2,"TrustLLM paper","Trustworthiness in Large Language Models","Framework / benchmark paper","Trustworthy LLM evaluation","Secondary framework to support trustworthiness dimensions and evaluation framing","Use in Related Work to support why trustworthiness must be multi-dimensional","Do not over-focus on this; use as supporting literature only","To read and summarise"
L3,"Phishing susceptibility review","Human-centered phishing susceptibility","Review paper","Why people are vulnerable to phishing","Supports our focus on user vulnerability and controlled persona conditions","Use in Introduction and Related Work to justify phishing-susceptible users as the target setting","Important: do not make deterministic claims about groups","To read and summarise"
L4,"Phishing detection behaviour study","How people detect phishing cues","Empirical paper","Human phishing cue recognition","Helps justify our detection-task design and red-flag reasoning","Use in Related Work and Error Analysis","Useful for discussing explanations and cue-based reasoning","To read and summarise"
L5,"Phishing mitigation review","Mitigation strategies against phishing","Systematic review","Recovery and mitigation actions","Supports the gold-standard remediation steps in our scoring","Use in Methodology and Discussion","Helps define what good phishing advice should contain","To read and summarise"
L6,"Australian Cyber Security Centre","Recognise and report scams","Official guidance","Safe actions after scams/phishing","Provides real-world recommended actions for recovery and reporting","Use in Methodology to define gold actions and in Discussion for practical relevance","High-value source for scoring rubric","To read and summarise"
L7,"Scamwatch","What to do if you've been scammed","Official guidance","Immediate response and recovery support","Provides reporting, recovery, and support advice","Use in Methodology and Discussion","Very useful for remediation and supportive advice criteria","To read and summarise"
L8,"Optional fairness/safety source","LLM fairness or safety auditing paper","Research paper","Bias/fairness auditing for LLMs","Can strengthen the fairness evaluation framing","Use only if needed in Related Work","Optional; do not waste too much time here","Optional"